target,id,date,flag,user,text
1,1832352326,Sun May 17 20:40:27 PDT 2009,NO_QUERY,rayelynnlee,@lov3lyd0rk one week left and Ty's gone. Need the monies. 
1,2064728131,Sun Jun 07 07:01:29 PDT 2009,NO_QUERY,weisenly,"@vewe Hi, good evening, always busy, and a little bit tired, and U? "
1,2184093411,Mon Jun 15 15:24:45 PDT 2009,NO_QUERY,cheesie,Yay i quite happy it rained cuz i can wear my new shocking pink raincoat! 
1,1932728559,Tue May 26 22:05:09 PDT 2009,NO_QUERY,pschiendelman,"@1lenore You have cats, right? "
0,1687651469,Sun May 03 09:14:58 PDT 2009,NO_QUERY,1soulmtnbiker,Life is still upside down will this pain ever end ?  You don't know how much u miss someone till there not here 
0,2057914163,Sat Jun 06 13:54:21 PDT 2009,NO_QUERY,ShaneJoseph,Yay! Getting out of rehearsal early! Poor Mike 
0,2266219830,Sun Jun 21 08:07:09 PDT 2009,NO_QUERY,britpay01,Happy Fathers Day Dad! I Love You! Working at the golf course til 8  BECCA COMES TOMORROW!!!!!!
0,1967247020,Fri May 29 19:13:58 PDT 2009,NO_QUERY,lost_dog,@heaatherr I am lost. Please help me find a good home. 
0,1676284427,Fri May 01 21:35:54 PDT 2009,NO_QUERY,EmzWo,we lost in netball  but we'll win in tennis tomorrow.
1,2003830229,Tue Jun 02 07:13:11 PDT 2009,NO_QUERY,ro0cksy,@HotAmishChick  are you from Romania ? 
0,1467926153,Mon Apr 06 22:50:43 PDT 2009,NO_QUERY,IGetsBusy514,@EazyDoesIt87 NEGATIVE.. you lost my vote of confidence 
0,1996267146,Mon Jun 01 14:48:10 PDT 2009,NO_QUERY,hannahfaulkes,"right, i need to try and get some sleep. back to getting up at half 6 tomorow "
1,1982165892,Sun May 31 10:39:38 PDT 2009,NO_QUERY,erinpooka,my hair is now black 
1,1985419062,Sun May 31 17:03:59 PDT 2009,NO_QUERY,eanelmer,Enjoying some great sushi @ Lucky China. Very well done 
0,2051523473,Fri Jun 05 22:13:45 PDT 2009,NO_QUERY,asteliapuff39,@presto82 shut up please!  you make me miss my country! I love yuca! y platanos!
1,2059480095,Sat Jun 06 17:01:09 PDT 2009,NO_QUERY,abadgirll,Fuck the 6th 
1,2189123754,Mon Jun 15 23:17:42 PDT 2009,NO_QUERY,alsiladka,@clintonjeff @Whatleydude The movie would please those outside India more. Didn't really like it much as a movie &amp; story 
1,1979466270,Sun May 31 03:10:06 PDT 2009,NO_QUERY,thisisanna,LOL the british judge on masterchef said frick. I thought of was funny 
1,1676735776,Fri May 01 23:00:45 PDT 2009,NO_QUERY,arielmartinez,"i just got home, saw gema earlier today  and then had one of those random nights..."
1,2013745052,Tue Jun 02 23:27:45 PDT 2009,NO_QUERY,FawnDamara,ahh i never check my twitter maybe i should start &amp; had some good cactus club for dinss 
1,2061698385,Sat Jun 06 21:25:11 PDT 2009,NO_QUERY,RalTy,"tomorrow includes: working out at an ungodly hr, working 8to4 (in my book 9to5 ;), then cleaning the house, making a gay tony cake "
0,2262776007,Sat Jun 20 23:12:32 PDT 2009,NO_QUERY,Brandieee,@lizetyspagetti I love you&lt;333 and miss you and @yadiraa already 
0,1977426838,Sat May 30 20:57:28 PDT 2009,NO_QUERY,marci723,@mitchelmusso http://twitpic.com/6b5i1 - COME TO THE CITY!!!!!!!!!!! 
1,1834896855,Mon May 18 04:32:51 PDT 2009,NO_QUERY,Marketplaceuk,This One Is For You - Free Marketing  | MangoOrangeï¿½ http://bit.ly/hPaj6
0,2014848709,Wed Jun 03 02:53:25 PDT 2009,NO_QUERY,abtony,@polka_ Good Afternoon Lady! I feel sorry abt the demise of your Grandaunt! 
0,1981968052,Sun May 31 10:15:28 PDT 2009,NO_QUERY,ChristianLondon,@younglyxx ouch!!! That hurted.....that's not fair bcus I ended up not making anything remember?!?!? 
1,1983727093,Sun May 31 13:43:01 PDT 2009,NO_QUERY,SamSchiz0phrnia,myysppace suckkas 
1,1964652122,Fri May 29 14:34:53 PDT 2009,NO_QUERY,stefant,relaxing after a week with days much longer than I can handle  and next week we have KMS launch and CERF. Good stuff 
0,2184300083,Mon Jun 15 15:42:30 PDT 2009,NO_QUERY,lesliejam,Back to the reality of Physical Therapy 
1,2001933644,Tue Jun 02 02:34:40 PDT 2009,NO_QUERY,natwebb,"@bradiewebb, calm yo' farm "
1,1978814214,Sun May 31 00:33:39 PDT 2009,NO_QUERY,SarahREii,uploading a video in youtube 
0,2215401511,Wed Jun 17 18:05:24 PDT 2009,NO_QUERY,SSpaceGirl,@jaedde  Hey!  I'm going through Kim withdrawals.  
1,1991134623,Mon Jun 01 06:28:14 PDT 2009,NO_QUERY,Jillzey,"@Inkognegro Not really but I don't like most kids movies, so I'm not the one to really ask. The Kid says I don't have a heart. "
0,2178475677,Mon Jun 15 07:45:24 PDT 2009,NO_QUERY,Cerealkiller333,One word. GUY BERRYMAN. ...I want his beef 
1,1984568261,Sun May 31 15:21:51 PDT 2009,NO_QUERY,WookieeChew,@piano89 I'll be praying for you.  When is it exactly?
1,1994892054,Mon Jun 01 12:37:20 PDT 2009,NO_QUERY,joedanx3,"@Marieeeee20 haha, thanks?  lol"
1,1556403404,Sat Apr 18 22:42:15 PDT 2009,NO_QUERY,DDote77,"@annahawkins Plus, we have Panera and Powells. "
0,2207160667,Wed Jun 17 07:33:56 PDT 2009,NO_QUERY,marydoyouwanna,i hate tlc for ruining my favorite hour of the day. i make sure i'm awake to see say yes to the dress from 11-12. now its only at 11 
1,2056069992,Sat Jun 06 10:28:18 PDT 2009,NO_QUERY,MsStaceyK,@ReBeLR yea give of another deep listen J is really spitting some truth 
0,2051213824,Fri Jun 05 21:09:13 PDT 2009,NO_QUERY,lizdanzer,Yay!! Twitter is back!! I did miss it so   #padres down 5-0 still...
0,2069689568,Sun Jun 07 16:20:40 PDT 2009,NO_QUERY,evanafter,'s dru level is back to about 90%. Now she just needs to get the purity level back up. 
0,1983049316,Sun May 31 12:24:22 PDT 2009,NO_QUERY,Tiffanyvetobe,miss him already   this is not like me...
1,2060139231,Sat Jun 06 18:20:05 PDT 2009,NO_QUERY,hudderson4,Loves the new moon trailer !!  &lt;3
0,2219500755,Thu Jun 18 00:40:55 PDT 2009,NO_QUERY,missravenna,damn boyfriend jumping into bed at 7am drunk :| cant get back to sleep now 
1,2065611849,Sun Jun 07 08:57:02 PDT 2009,NO_QUERY,mashteh,@Orion_Girl *smiles* Always come back..   Love Shara!
1,1972212805,Sat May 30 08:47:32 PDT 2009,NO_QUERY,ryanbelk,"Beach, birthday hang outs for michael, michaels sisters house for a BBQ, home, relax!....gosh i freakin lover summer!! "
1,2014691517,Wed Jun 03 02:22:05 PDT 2009,NO_QUERY,jasonauk,on a roll with these jingles now 
0,2246624194,Fri Jun 19 17:52:47 PDT 2009,NO_QUERY,saulecker,"@fullsteam I'll set my DVR, but I don't know how to get stuff off it "
1,1995937086,Mon Jun 01 14:16:44 PDT 2009,NO_QUERY,Shopaholic_Mama,my daughter has been sleeping for 3 1/2 hours!!! the Friendly's kids meal must have knocked her out 
1,2045437518,Fri Jun 05 10:43:31 PDT 2009,NO_QUERY,SubhiG,"It is fearlessness, and it is love&quot; - Vince Lombardi. Thank you very much "
0,2259766460,Sat Jun 20 18:07:38 PDT 2009,NO_QUERY,MissMaryMacc,This sucks. I want my baby to come home. 
0,2236488047,Fri Jun 19 03:50:06 PDT 2009,NO_QUERY,EminaOsmanovic,@officialTila TILA can I get a shout ?? 
1,2012651370,Tue Jun 02 21:02:19 PDT 2009,NO_QUERY,AgeAdrienne,"Oh @nbcconan, I haven't laughed this much in a while. "
0,2201923838,Tue Jun 16 20:58:33 PDT 2009,NO_QUERY,k3vlai,i cant believe billy died. 
0,2223108206,Thu Jun 18 07:51:41 PDT 2009,NO_QUERY,KickAssCaz,@Bailey_FF It's not good 
1,2187090490,Mon Jun 15 19:46:33 PDT 2009,NO_QUERY,KaylaBearD,Chillin with my aunt and sister  gotta love popcorn! Hehe. Have a great night! Love to ya'll  Kay~Kay &lt;3
0,2214163219,Wed Jun 17 16:21:20 PDT 2009,NO_QUERY,miseryunknown,stuDYING.  dates suck. got all the titles and the majority of the artists though! woop.
1,1565956361,Mon Apr 20 07:55:04 PDT 2009,NO_QUERY,Twisted_Wick,@ErikJHeels Wish I was there!!!! Have fun!  Go Sox!
0,2064203316,Sun Jun 07 05:33:46 PDT 2009,NO_QUERY,marcii_chan,@Rutto_chan i'm sorry for making you worried   i promise u that i talk to u later but i need to get away for everyone now (...)
1,2067296378,Sun Jun 07 12:05:46 PDT 2009,NO_QUERY,JooWang,Always thanks to my brother for waking me up early. Now about to get some fuhh and then go paint! 
0,2324788401,Thu Jun 25 04:02:45 PDT 2009,NO_QUERY,MyBugs2Love,Im just getting back from the ER.  i fell and broke my arm.  This sucks 
1,1753712252,Sun May 10 03:02:30 PDT 2009,NO_QUERY,Nerrida_,@Matt_D_ happy birthday 
0,2218339832,Wed Jun 17 22:18:12 PDT 2009,NO_QUERY,hectornova,"New iPhone OS was a long time coming. Glad to finally have a landscape keyboard though, twitterfon excluded so far. "
1,2051841308,Fri Jun 05 22:56:46 PDT 2009,NO_QUERY,CinnInSoCal,"@LadyCromwell Glad you like it, when i find something useful I share it, it can only do good "
1,1969959009,Sat May 30 01:53:19 PDT 2009,NO_QUERY,joycescapade,@minimum12 Hi! Just followed you. Where are you currently? 
0,2205236389,Wed Jun 17 04:17:09 PDT 2009,NO_QUERY,iianardo,@drewaaroncomley dude im gunna be away for that show  this makes me extremely sad.
0,2249142643,Fri Jun 19 21:47:41 PDT 2009,NO_QUERY,taylorfarley,I wish Entourage would finish so I could watch it 
1,2058929553,Sat Jun 06 15:54:40 PDT 2009,NO_QUERY,AlekThomas,@DPAD_Magazine if you go on the sims you just wont go to bed atall. so uncharted2b 
1,1992521980,Mon Jun 01 08:53:23 PDT 2009,NO_QUERY,BryceRaiff,following the twitter trend  
0,2065094886,Sun Jun 07 07:52:55 PDT 2009,NO_QUERY,Misshehehe,This is not a fun feeling. 
0,2052836942,Sat Jun 06 02:12:56 PDT 2009,NO_QUERY,LuLu88A,"wish my real friends with me now !!  ,, miss u guyZ"
0,2048576394,Fri Jun 05 15:25:36 PDT 2009,NO_QUERY,jonna404,Locked out of my house 
0,2211635529,Wed Jun 17 13:05:46 PDT 2009,NO_QUERY,djdonx,@efalase u mean s sugar u abandoned?? 
0,1982795306,Sun May 31 11:55:08 PDT 2009,NO_QUERY,sydeshow,"@KikoNightmare your phone's never gonna learn it  I had a pearl for a year, tried to teach it and never could make it the first t9 choice"
0,2260586544,Sat Jun 20 19:27:29 PDT 2009,NO_QUERY,BlondeBlogger,http://twitpic.com/7ywp6 - downtown va beach. that's as close as i got to the ocean.  no time to hit the beach.
1,2015695277,Wed Jun 03 05:18:19 PDT 2009,NO_QUERY,Mark_A_Nolan,@HughSachs Welcome to the happy world of Twitter 
0,2327901776,Thu Jun 25 08:55:44 PDT 2009,NO_QUERY,wliyuans," My turtle food! Its starving. ;( Im sorry, turtles. ;( I promise i buy tmr. ;("
1,1979706050,Sun May 31 04:10:27 PDT 2009,NO_QUERY,daantje_nl,adding my new sound system to my cruizer  http://www.tommyca.net
0,1984015879,Sun May 31 14:16:35 PDT 2009,NO_QUERY,xvs,@kogas Idk ATM. Completely. 
0,2286317240,Mon Jun 22 16:16:53 PDT 2009,NO_QUERY,campfires,@sabinagl  what's wrong? You don't have to tell me if you don't wanna but I'm here if you wanna talk
1,1980008781,Sun May 31 05:21:32 PDT 2009,NO_QUERY,privatestudmuff,marco leading hi home gp comeon 
0,1793097301,Thu May 14 01:21:45 PDT 2009,NO_QUERY,b2fanimation,"spent ages yesterday setting up message filters on thunderbird, only for them not to work today. shakes fist in anger "
0,2067642160,Sun Jun 07 12:42:15 PDT 2009,NO_QUERY,little_peanut,writing something about people you got to know many years ago is so difficult 
1,1973502288,Sat May 30 11:16:27 PDT 2009,NO_QUERY,moondoggie_de,Enjoying the worlds greatest sushi   http://yfrog.com/7hsw3j
1,1979656166,Sun May 31 03:58:38 PDT 2009,NO_QUERY,danielle_1811,:maczombierawr &quot;Drag me to hell&quot; Was it okay? Scary?? and worth watching 
1,2011034548,Tue Jun 02 18:22:19 PDT 2009,NO_QUERY,likeomgshhfool,"so i've come to the conclusion, Jacob turns into a pretty warewolf, his fur color is soo gorgeous!! "
1,2008810770,Tue Jun 02 14:41:41 PDT 2009,NO_QUERY,LaughNYC,WhatKs that smell in here?  (www.LaughNYC.com)
1,1968047440,Fri May 29 20:39:53 PDT 2009,NO_QUERY,pinkielarue,@stellery @stellery oh hai! what are you up to this friday night? I'm  probably going to log on to an alt to avoid raiding 
0,1554455426,Sat Apr 18 17:02:37 PDT 2009,NO_QUERY,Mheartstar,ok so my brother just got a mac book and its so much prettier than mine lol 
0,2249248890,Fri Jun 19 21:59:16 PDT 2009,NO_QUERY,nathvieira,"ohhhhhh, miss here... MCFLY, I NEED SEE YOU AGAIN GUYS "
1,1754062366,Sun May 10 04:48:28 PDT 2009,NO_QUERY,TheChiz,I like the tiny things that can make the rest of the day way better 
0,2206849299,Wed Jun 17 07:08:25 PDT 2009,NO_QUERY,Katleavixen,"now has a doctors appointment then another hospital one tomoro, i was right, day 2 and im already tired "
1,1792960366,Thu May 14 00:51:09 PDT 2009,NO_QUERY,balazsgal,"@c_davies good morning, its exactly the same here in munich, but they are building a whole house here "
1,1468055253,Mon Apr 06 23:28:39 PDT 2009,NO_QUERY,MichaelMcA,in Aries with peter and luke 
1,1753836820,Sun May 10 03:42:27 PDT 2009,NO_QUERY,pwilson,"You know when your make late night calls to India team members for more pictures, your struggling with your message.  Thanks @angelac519."
1,1564040574,Mon Apr 20 01:28:08 PDT 2009,NO_QUERY,missycbailey,Thanks God for such a wonderful husband! I love him more than he will ever know! He is such an incredible daddy too! My dream come true! 
1,1999913551,Mon Jun 01 21:03:11 PDT 2009,NO_QUERY,ennui1981,"@czarles @pluish Will use this free time to practice my handwriting again. Typing here in Twitter doesn't count, naturally. Hehe... "
0,2044054063,Fri Jun 05 08:48:08 PDT 2009,NO_QUERY,ktjune,LA is gloomy right now 
0,1548674463,Fri Apr 17 21:37:44 PDT 2009,NO_QUERY,Snuva,"@mundoo Sorry to hear that  But congratulations on the rain a few hours ago! If it helps, my lawn is just a dust bowl."
1,1880550554,Fri May 22 01:38:43 PDT 2009,NO_QUERY,finkcards,"Good Morning Everyone! Its Friday, the Sun is shining and its a bank holiday weekend. Life is GOOD "
0,2264655736,Sun Jun 21 04:33:01 PDT 2009,NO_QUERY,saragarth,"@littlefurybug I feel so sorry for you love.  really, I do. (btw, if this was a movie, we'd make MILLIONS!)  &lt;3 x"
0,2262696128,Sat Jun 20 23:02:21 PDT 2009,NO_QUERY,AudreyCappu,dáº¡o nÃ y lÃºc nÃ o cÅ©ng cÃ³ cáº£m giÃ¡c bá» lá»«a dá»i  chÃ¡n quaaaaÃ¡..mÃ¬nh bá» ÄiÃªn rá»i
0,2261550041,Sat Jun 20 20:58:04 PDT 2009,NO_QUERY,Justacr0sshair,@Paracinema  you know I'm a tweenie at heart
0,1968351634,Fri May 29 21:15:31 PDT 2009,NO_QUERY,shelbymaine,Watching tv then going to sleep. Work tomorrow 
0,2249363545,Fri Jun 19 22:11:28 PDT 2009,NO_QUERY,Simplegreenvr6,Not feeling well at all 
1,1979341713,Sun May 31 02:37:54 PDT 2009,NO_QUERY,Bloodl3tt3r,"Hell Yeah  Thanx!!!!!!!!@ms_jonesin: &quot;yes, yes... more Hedwig&quot; ? http://blip.fm/~7d8tr"
0,2285297779,Mon Jun 22 14:57:26 PDT 2009,NO_QUERY,horriblehannah,Went on a college tour of st bens/st johns. I didnt like the school and plus its so hot that i feel like im going to die 
1,1979905210,Sun May 31 04:58:32 PDT 2009,NO_QUERY,ingek73,Everyone exited about the Take That tour say *Wayhey!*/Everyone exited about new moon say  *swoon* 
1,1979171800,Sun May 31 01:55:41 PDT 2009,NO_QUERY,fcharlton,"@Jason_Manford Hey, bung me an iphone and i'd be glad to play any time of day or night mate "
0,2201099624,Tue Jun 16 19:48:17 PDT 2009,NO_QUERY,DestinyTrack42,@SakaraRoss1of1 I miss you already!  You better come tomorrow... OR ELSE! HOLLA!
1,2060438166,Sat Jun 06 18:54:25 PDT 2009,NO_QUERY,misskatiexo,applebees with nick &amp; the parents  grad ceremony tmro!
0,2052165084,Fri Jun 05 23:51:35 PDT 2009,NO_QUERY,iGuido85,Damn.. Red Sox defeated by Texas Rangers at Fenway park..! 
1,2007560967,Tue Jun 02 12:49:14 PDT 2009,NO_QUERY,LozzBOOM,@suitcaseKid i will try and make my sound work next 
0,1686440273,Sun May 03 05:26:41 PDT 2009,NO_QUERY,FeatherMeringue,Poor doodle dogs. Nobody wants to look like a monstrosity. 
0,2059886191,Sat Jun 06 17:50:09 PDT 2009,NO_QUERY,pascale3206,Wants to see her troupe 
0,1976414020,Sat May 30 17:16:34 PDT 2009,NO_QUERY,pjhelton,Just left the er with my mom. She had to get stitches in her finger   *~BLESSED~*
1,1882095697,Fri May 22 06:13:19 PDT 2009,NO_QUERY,HarryHarley,"@sexkellystyle Yeah mine was like that today, well not that I call it a twat but hey that's cool lol "
0,1565611938,Mon Apr 20 07:09:49 PDT 2009,NO_QUERY,tiffiny4,My son just peed on me. And...I had just gotten dressed. 
0,2255837913,Sat Jun 20 11:51:58 PDT 2009,NO_QUERY,starrex5490,Another gloomy day 
1,1985699282,Sun May 31 17:36:22 PDT 2009,NO_QUERY,cleominette,@babyblackbear yes! I'm ready. At the same time again? 
0,2071761051,Sun Jun 07 19:53:15 PDT 2009,NO_QUERY,nimajones,@jimjonescapo I WISH I WAS DERE 
0,2055690813,Sat Jun 06 09:46:48 PDT 2009,NO_QUERY,HambyDavid,Apple today- then fido. No coldplay. 
1,2176265190,Mon Jun 15 03:23:22 PDT 2009,NO_QUERY,liampennock,@Mukoja do you use Facebook Mr. 
0,1881452444,Fri May 22 04:42:20 PDT 2009,NO_QUERY,ShannaMarie,Ugh...I got 3 hours of somewhat sleep and now its off to work.. Fml 
1,1985401250,Sun May 31 17:02:02 PDT 2009,NO_QUERY,kasmac92,THE HILLS IS ON 2NITE! YAY 
0,2215030714,Wed Jun 17 17:34:31 PDT 2009,NO_QUERY,Tinkerbell_03,Bored out of my freaking mind! 
1,1992270599,Mon Jun 01 08:28:50 PDT 2009,NO_QUERY,whereivebeen,@ShoshTrvls  You are more than welcome!    Enjoy!
1,1970427842,Sat May 30 03:49:47 PDT 2009,NO_QUERY,xemmawinterx,@shaundiviney Nice backround. I would soooo beat you tho! 
0,1565196148,Mon Apr 20 06:09:17 PDT 2009,NO_QUERY,Skylten,@zoziekins I hate my life haha. I need to pass this too  Ugh.
1,1827937390,Sun May 17 11:45:22 PDT 2009,NO_QUERY,ryaaaaaan,And it begins again 
0,2192241125,Tue Jun 16 06:44:07 PDT 2009,NO_QUERY,twitteratti,@epc I feel your pain 
0,1565606105,Mon Apr 20 07:08:58 PDT 2009,NO_QUERY,tjeanj,Mood today - 
0,2327343564,Thu Jun 25 08:13:40 PDT 2009,NO_QUERY,Mirenny,@lindyjomac Lindy i'm trying!  no luck yet...
0,2200415031,Tue Jun 16 18:52:08 PDT 2009,NO_QUERY,NiciNarcissism,i look gross... that gurl asked if i had skin cancer..... 
1,1972129611,Sat May 30 08:37:12 PDT 2009,NO_QUERY,megxcanxfly,i love summer.. I think I'll just pass my winter in a winter sleep. How brilliant is that? 
0,2062131863,Sat Jun 06 22:24:54 PDT 2009,NO_QUERY,Cavsrock09,&quot;You were assassinated Johalonos&quot; 
1,1751214750,Sat May 09 18:55:58 PDT 2009,NO_QUERY,Nautinkotbkitty,@JonathanRKnight I am jealous...Ur koi fish are getting ur attention &amp; I'm not.....lmao   I'm kidding!!    
0,1969144436,Fri May 29 23:08:58 PDT 2009,NO_QUERY,clearbrook00,"First day of freedom, missing my friends already, for in fact I don't see them as students, but as friends. "
0,1556664975,Sat Apr 18 23:47:01 PDT 2009,NO_QUERY,laurenalli,"home sweet home, sickling is in bed and my eyes are fighting to stay open. time to crawl into bed, i have to function for the ap tour "
1,1694069540,Mon May 04 00:57:02 PDT 2009,NO_QUERY,amathist,@nomek is new van a nice one 
1,2053416644,Sat Jun 06 04:28:49 PDT 2009,NO_QUERY,dynask,"Pancakes, music and train... "
1,1752984386,Sat May 09 23:41:28 PDT 2009,NO_QUERY,Apolladora,"@McCainBlogette Congrats!  I cuss like that in a matter of minutes, But didn't know until now there is a reward for it.  "
1,1557958804,Sun Apr 19 06:43:58 PDT 2009,NO_QUERY,ycarocoelho,http://migre.me/ymR - comment if u have flickr 
1,1880226521,Fri May 22 00:30:53 PDT 2009,NO_QUERY,caitlinmulvey,@nishita1 thankss!!! 
1,1573564105,Tue Apr 21 01:46:21 PDT 2009,NO_QUERY,silvernadine27,hahahaha the person who hate's me can't open my account  .
1,1771082238,Mon May 11 23:08:21 PDT 2009,NO_QUERY,metaglyph,@tweenkle77 oh goodnight! didn't get much of a chance to tweet with you.. tomorrow then? 
0,1824952139,Sun May 17 03:40:33 PDT 2009,NO_QUERY,biestmilch,"try to restructure our website http://tinyurl.com/pedwso ï¿½ never ending work in progress, but now I got stuck "
1,2018149989,Wed Jun 03 09:30:57 PDT 2009,NO_QUERY,NikoleCamarae,@macfeather926 I'm in linei 
0,1822426482,Sat May 16 19:33:04 PDT 2009,NO_QUERY,Yessee,Ughh !!!!! My stomach hurts  and I feel blahhh. &lt;/3
0,1836203923,Mon May 18 07:34:16 PDT 2009,NO_QUERY,ShaunPynne,Had to take a sick day  it's crazy because I'll start missing the office by mid afternoon!
0,1960140597,Fri May 29 07:29:19 PDT 2009,NO_QUERY,b_____,"@KoSoVaR  got a limit sell @ .94 for even pretty much, cover commissions. Didn't like my entry on this one "
0,1976098888,Sat May 30 16:34:59 PDT 2009,NO_QUERY,activistchica,@Ashley_NK Me too chica. I always lose shit. This time I used a tiny wallet like paper thin black. Hard to see! Shit!! 
1,2072392829,Sun Jun 07 20:56:25 PDT 2009,NO_QUERY,rossval,my name in Latin  is Beate Bellona 
0,2252368183,Sat Jun 20 06:06:41 PDT 2009,NO_QUERY,jhazelgrove,Seriously doubting I'l be able to get all these videos on the iPhone before I hafta leave 
0,2328818606,Thu Jun 25 10:01:34 PDT 2009,NO_QUERY,redstar72,"CAN'T BEAT LIVE MUSIC, WISH I COULD SING BUT I CAN'T "
0,2067254653,Sun Jun 07 12:01:27 PDT 2009,NO_QUERY,sazzlefrazzlee,OMG. I'm crying. OOOOOOOOWWW. I was dancing and I hit my arm on the desk and It hurts  Pray for me. Amen.
0,2218096577,Wed Jun 17 21:53:06 PDT 2009,NO_QUERY,F0LL0W3R,Sigh i don't like coughing so much  Refinnyj &lt;&gt; Mat1234
0,2013691896,Tue Jun 02 23:19:07 PDT 2009,NO_QUERY,jazziebaby,"Wtff, there's a HOLD UP @ROSS, DALY CITY! "
1,2061602532,Sat Jun 06 21:12:48 PDT 2009,NO_QUERY,macyxxx,Going rollerskating with my favorite people ever. I love my birthday haha 
1,2063685593,Sun Jun 07 03:40:18 PDT 2009,NO_QUERY,adilialima,is waking up 
0,2048613192,Fri Jun 05 15:29:15 PDT 2009,NO_QUERY,hsahsa,so much work to do on weekend 
1,2048008604,Fri Jun 05 14:31:13 PDT 2009,NO_QUERY,aaburlos,Toris house. dancee. brislans for the niight ! text 
1,1882620050,Fri May 22 07:11:44 PDT 2009,NO_QUERY,ayooo016,I'm home  whewww
1,1997197960,Mon Jun 01 16:25:39 PDT 2009,NO_QUERY,amandarenee513,Just got home....I am super tired. I think I am going to take 30 min nap 
0,1995773644,Mon Jun 01 14:01:32 PDT 2009,NO_QUERY,JennHeartsRomeo,im back from my aunts lets just say im worn out  and hurt my knee even worse. but now im having a cook out so be back later. love you guys
0,1967726759,Fri May 29 20:06:15 PDT 2009,NO_QUERY,amykayODT,@BluePhoenix1 unfortunately I don't think they're going to... 
1,2063407619,Sun Jun 07 02:32:09 PDT 2009,NO_QUERY,OzGroover,@ThisIsRobThomas YAY!!! That's because I had my fingers crossed for you!! 
1,2008849415,Tue Jun 02 14:45:19 PDT 2009,NO_QUERY,MarieMJS,"@maddrell argh Murray is out!! Hopefully Wimbledon? Now keep your fingers crossed for our little Frenchie, I think he does deserve it "
1,1962318832,Fri May 29 10:51:43 PDT 2009,NO_QUERY,annasaccone,@anaderol1977 i was watching your vid on superfoods yday...i would love to see more like that one!  only when you have time! x
0,2182876472,Mon Jun 15 13:45:08 PDT 2009,NO_QUERY,milesbrazil,@billyraycyrus @TraceCyrus OMGGG!!!!!!!!!! what should i do :????? u dont talk to me..   ;.     plz answer me!!  I LOVE U ALL
1,2180526808,Mon Jun 15 10:35:26 PDT 2009,NO_QUERY,bexatron,Q3: Theatrical-post-punk-pure-awesomeness. or just &quot;stuff I love&quot;  #MCRchat
0,2187409120,Mon Jun 15 20:14:22 PDT 2009,NO_QUERY,PrincessSwaQq,@JayBooker u still aint come u abandoned me  http://myloc.me/3Zhv
1,1823843917,Sat May 16 23:10:01 PDT 2009,NO_QUERY,snarkykisses,@kimt205 I just love that...so much. They are so so loveable! 
1,1827413468,Sun May 17 10:39:33 PDT 2009,NO_QUERY,limegreenmodern,"...we are heading out to take a hike...need to get the provisions ready, they are the most important part to my DS8 and DD3. "
0,1467842568,Mon Apr 06 22:28:07 PDT 2009,NO_QUERY,josiahmcdermott,i miss kenny powers 
1,2185121728,Mon Jun 15 16:55:08 PDT 2009,NO_QUERY,rich97,@redheaddesign Depends if you like tinkering with your machine. Or if you need it. 
0,1468750546,Tue Apr 07 03:31:57 PDT 2009,NO_QUERY,devanp16,my back is so sore!  poor me! (this is the part where u give me lots of sympathy)
1,1565198747,Mon Apr 20 06:09:42 PDT 2009,NO_QUERY,MzSoExclusive,Ughh Is Mad Bored At Vo-Tech Dis Morning Dnt Feel Like Typing Nothin Ready To Get Bak To PHS All Smiles Doe  
1,1964427377,Fri May 29 14:13:07 PDT 2009,NO_QUERY,ChazzyCat,@paulpuddifoot thanks 
0,1956497358,Thu May 28 22:00:30 PDT 2009,NO_QUERY,Ms_Nicholson,@InnyVinny but porns suck 
1,1832946834,Sun May 17 21:53:32 PDT 2009,NO_QUERY,JoshKin,Itching to see Star Trek  But i have to wait 5 more days to see it.. Darn it!!
1,1970269639,Sat May 30 03:09:30 PDT 2009,NO_QUERY,facebook_rt,"@CrashOverride71 @officialTila I'm also on facebook, you can find under my email add.  it's jimmyjohnsonii@hotmail.com "
0,1563965567,Mon Apr 20 01:05:35 PDT 2009,NO_QUERY,karleexx,emma and lori just left...now i should probably do some homework 
0,1694276560,Mon May 04 01:53:08 PDT 2009,NO_QUERY,Kornkaos,just got the Iphone Developers standard thing... waiting to use it and try out Iphone OS 3 at the same time -_- it says it may take 24hrs 
1,2058568201,Sat Jun 06 15:11:52 PDT 2009,NO_QUERY,misskyra,Fun swimming workout. 
0,2187499719,Mon Jun 15 20:22:23 PDT 2009,NO_QUERY,EmuMidget420,storms came close but didnt see much action  prolly wont
0,2226607483,Thu Jun 18 12:09:43 PDT 2009,NO_QUERY,Unwantedlove,@maroon5 Aww poor Jimmy  I misspell things all the time. Well I don't hate you even if you can't spell tattoo right lol
1,1978965283,Sun May 31 01:06:15 PDT 2009,NO_QUERY,janine_j9,@TimothyH2O chocolate bliss!!!!!!!!! ahaha. they melt in your mouth. ahhhh.  it makes a mess but its worth it 
0,2328156428,Thu Jun 25 09:14:16 PDT 2009,NO_QUERY,AvanikaYB,"@RiaMathew How were the lava cakes? And could you mail details of the course you're joining?? I'd love to go with you, but I have exams "
1,1986473822,Sun May 31 18:52:59 PDT 2009,NO_QUERY,nataliabialecki,McFly at Panico! I LOVED  'ronaldo' very cutee
1,1824018707,Sat May 16 23:45:23 PDT 2009,NO_QUERY,zacharybk,"@JoannaLord  not everyone gets one, sorry "
0,1554044546,Sat Apr 18 15:55:04 PDT 2009,NO_QUERY,bdieu,"alarm at the Marriott Marquis has been going on for 2 hours...jumped out of my bath, went down 45 floors - apparently malfunctioning "
1,2069827605,Sun Jun 07 16:36:02 PDT 2009,NO_QUERY,rgdiaz,@ObscureHorror In regards to JC2 It had alot of action and some gore. W00t w00t @ guys with no shirts  The Creeper was awesome!
